{
  "decision": "get a dog",
  "pros": [
    {
      "description": "Improved Physical Health",
      "impact": 8.0,
      "likelihood": 9.0,
      "cost": 10.0
    },
    {
      "description": "Enhanced Mental Well-being",
      "impact": 9.0,
      "likelihood": 10.0,
      "cost": 15.0
    },
    {
      "description": "Increased Social Connections",
      "impact": 6.0,
      "likelihood": 5.0,
      "cost": 5.0
    },
    {
      "description": "Companionship and Emotional Support",
      "impact": 10.0,
      "likelihood": 10.0,
      "cost": 3.0
    },
    {
      "description": "Reduced Stress and Anxiety",
      "impact": 7.0,
      "likelihood": 8.0,
      "cost": 5.0
    }
  ],
  "cons": [
    {
      "description": "Increased financial costs",
      "impact": 5.0,
      "likelihood": 10.0,
      "cost": 20.0
    },
    {
      "description": "Time commitment and scheduling limitations",
      "impact": 9.0,
      "likelihood": 10.0,
      "cost": 15.0
    },
    {
      "description": "Potential for damage to furniture or belongings",
      "impact": 5.0,
      "likelihood": 9.0,
      "cost": 100.0
    },
    {
      "description": "Need for regular veterinary care and vaccinations",
      "impact": 6.0,
      "likelihood": 9.0,
      "cost": 100.0
    },
    {
      "description": "Increased stress and anxiety due to potential separation issues",
      "impact": 5.0,
      "likelihood": 9.0,
      "cost": 10.0
    }
  ],
  "timestamp": "2025-01-04T15:38:35.592548",
  "ai_analysis": {
    "analysis": {
      "summary": "**Decision Analysis: Getting a Dog**\n\n**Summary of Key Points**\n\nThe decision to get a dog involves weighing the benefits against the drawbacks. The pros highlight significant improvements in physical...",
      "confidence": 0.8,
      "recommendations": [
        "**Decision Analysis: Getting a Dog**\n\n**Summary of Key Points**\n\nThe decision to get a dog involves weighing the benefits against the drawbacks. The pros highlight significant improvements in physical health, mental well-being, social connections, companionship, and emotional support. However, the cons reveal potential financial strain, time commitment limitations, damage to property, veterinary care expenses, and stress due to separation issues.\n\n**Quantitative Analysis**\n\nTo calculate the weighted impact of each factor, we multiply the Impact score by the Likelihood score:\n\nPros:\n\n* Improved Physical Health: 8.0 \u00d7 9.0 = 72.0\n* Enhanced Mental Well-being: 9.0 \u00d7 10.0 = 90.0\n* Increased Social Connections: 6.0 \u00d7 5.0 = 30.0\n* Companionship and Emotional Support: 10.0 \u00d7 10.0 = 100.0\n* Reduced Stress and Anxiety: 7.0 \u00d7 8.0 = 56.0\n\nCons:\n\n* Increased financial costs: 5.0 \u00d7 10.0 = 50.0\n* Time commitment and scheduling limitations: 9.0 \u00d7 10.0 = 90.0\n* Potential for damage to furniture or belongings: 5.0 \u00d7 9.0 = 45.0\n* Need for regular veterinary care and vaccinations: 6.0 \u00d7 9.0 = 54.0\n* Increased stress and anxiety due to potential separation issues: 5.0 \u00d7 9.0 = 45.0\n\nTo calculate the total weighted impact, we sum up the products of each factor:\n\nTotal Weighted Impact:\nPros: 72.0 + 90.0 + 30.0 + 100.0 + 56.0 = 348.0\nCons: 50.0 + 90.0 + 45.0 + 54.0 + 45.0 = 284.0\nNet Weighted Impact: 348.0 - 284.0 = 64.0\n\n**Cost-Benefit Analysis**\n\nWe calculate the total cost of getting a dog by adding up all financial implications:\n\n* Initial expenses (e.g., adoption fees, vaccinations): $200.0\n* Monthly expenses (e.g., food, supplies): $100.0 per month \u00d7 12 months = $1,200.0 per year\n* Potential damages or vet bills: $10.0 (one-time) + $5.0 (recurring)\n\nTotal Cost: Initial expenses ($200.0) + Monthly expenses ($1,200.0) + Potential damages/vet bills ($15.0) = $1,415.0\n\nWe calculate the cost-benefit ratio by dividing the total weighted impact by the total cost:\n\nCost-Benefit Ratio: 64.0 (Weighted Impact) \u00f7 $1,415.0 (Total Cost) \u2248 0.0453\nIn favor of getting a dog.\n\n**Risk Assessment**\n\nBased on the likelihood and impact scores, we categorize each factor as low, medium, or high risk:\n\n* Low Risk:\n\t+ Increased social connections\n\t+ Reduced stress and anxiety due to companionship\n* Medium Risk:\n\t+ Time commitment and scheduling limitations\n\t+ Need for regular veterinary care and vaccinations\n* High Risk:\n\t+ Potential financial costs\n\t+ Potential damage to furniture or belongings\n\t+ Increased stress and anxiety due to potential separation issues\n\n**Potential Short-Term and Long-Term Consequences**\n\nShort-term:\n\n* Initial adjustment period as you get used to having a dog\n* Potential challenges with time commitment and scheduling limitations\n\nLong-term:\n\n* Ongoing financial costs and expenses for veterinary care, supplies, and damages\n* Potential long-term stress and anxiety due to separation issues or behavioral problems\n\n**Final Recommendation**\n\nBased on the quantitative analysis, cost-benefit ratio, risk assessment, and potential consequences, we recommend getting a dog. The weighted impact of benefits outweighs the drawbacks, and the cost-benefit ratio suggests that the benefits justify the costs.\n\nHowever, it is essential to consider individual circumstances and be aware of potential risks. To mitigate these risks:\n\n* Research and understand the needs and challenges associated with dog ownership\n* Create a budget for ongoing expenses and plan accordingly\n* Ensure you have enough time commitment and flexibility to care for a dog\n* Consider factors like breed, size, and energy level when choosing a dog\n\nUltimately, getting a dog can be a rewarding experience that improves your physical and mental health. By weighing the pros and cons carefully and taking steps to mitigate potential risks, you can make an informed decision that is right for you."
      ]
    },
    "evaluation": {
      "pros_analysis": {
        "total_impact": 348.0,
        "total_cost": 38.0
      },
      "cons_analysis": {
        "total_impact": 284.0,
        "total_cost": 245.0
      },
      "risk_assessment": {
        "risk_score": 56.8
      }
    },
    "metadata": {
      "model_used": "llama3.2",
      "timestamp": "2025-01-04T15:39:24.517398",
      "processing_time": 48.913816
    }
  }
}