{
  "decision": "take a nap",
  "pros": [
    {
      "description": "get some rest",
      "impact": 10.0,
      "likelihood": 0.7,
      "cost": 20.0
    }
  ],
  "cons": [
    {
      "description": "more stuff to do",
      "impact": 9.0,
      "likelihood": 10.0,
      "cost": 30.0
    }
  ],
  "timestamp": "2025-01-04T14:46:55.890510",
  "ai_analysis": {
    "analysis": "**Decision Analysis: Taking a Nap**\n\n**Summary of Key Points**\n\n* The decision to take a nap involves weighing the pros and cons of rest, productivity, and financial implications.\n* The analysis will consider the impact, likelihood, cost, and risk associated with each option.\n\n**Quantitative Analysis**\n\nTo calculate the weighted impacts and costs, we'll use the following formulas:\n\nWeighted Impact = Impact \u00d7 Likelihood\nCost-Benefit Ratio = (Benefit - Cost) / Benefit\n\nPros:\n- Get some rest: Weighted Impact = 10.0 \u00d7 0.7 = 7.0; Cost-Benefit Ratio = ($20.0 - $30.0) / $20.0 = -1.5\n- More stuff to do: Weighted Impact = 9.0 \u00d7 1.0 = 9.0; Cost-Benefit Ratio = -$30.0 (negative cost)\n\nCons:\nSince the likelihood of getting more stuff done is 100%, it outweighs the rest option in terms of impact.\n\n**Risk Assessment**\n\nTo assess risk, we'll consider the combination of likelihood and impact scores:\n\n* Rest: High Likelihood \u00d7 Moderate Impact (High Risk)\n* More stuff to do: Low Likelihood \u00d7 High Impact (Low Risk)\n\nBased on the analysis, taking a nap carries higher risk due to high likelihood and moderate impact.\n\n**Potential Short-term and Long-term Consequences**\n\nShort-term consequences:\n- Taking a nap might lead to decreased productivity for a short period.\n- Not taking a nap might result in burnout or decreased focus.\n\nLong-term consequences:\n- Regular naps can improve cognitive function, memory, and creativity. Chronic sleep deprivation can have severe long-term effects on physical and mental health.\n- The decision to prioritize rest or productivity will impact overall well-being and quality of life.\n\n**Final Recommendation**\n\nBased on the analysis:\n\n1.  Considering high risk and moderate impact, taking a nap is not recommended.\n2.  Instead, consider prioritizing tasks with lower likelihood (10% chance) but high impact (9.0).",
    "model_used": "llama3.2:latest",
    "timestamp": "2025-01-04T14:47:10.928603"
  }
}